commit 260e41ac4dd3e5acb90be624c03ba7f019615b75
Author: Jerónimo Borque <jeronimo@borque.com.ar>
Date:   Thu Jan 9 12:23:34 2020 -0300

    USB: serial: simple: Add Motorola Solutions TETRA MTP3xxx and MTP85xx
    
    Add device-ids for the Motorola Solutions TETRA radios MTP3xxx series
    and MTP85xx series
    
    $ lsusb -vd 0cad:
    
    Bus 001 Device 009: ID 0cad:9015 Motorola CGISS TETRA PEI interface
    Device Descriptor:
      bLength                18
      bDescriptorType         1
      bcdUSB               2.00
      bDeviceClass            0
      bDeviceSubClass         0
      bDeviceProtocol         0
      bMaxPacketSize0        64
      idVendor           0x0cad Motorola CGISS
      idProduct          0x9015
      bcdDevice           24.16
      iManufacturer           1
      iProduct                2
      iSerial                 0
      bNumConfigurations      1
      Configuration Descriptor:
        bLength                 9
        bDescriptorType         2
        wTotalLength       0x0037
        bNumInterfaces          2
        bConfigurationValue     1
        iConfiguration          3
        bmAttributes         0x80
          (Bus Powered)
        MaxPower              500mA
        Interface Descriptor:
          bLength                 9
          bDescriptorType         4
          bInterfaceNumber        0
          bAlternateSetting       0
          bNumEndpoints           2
          bInterfaceClass       255 Vendor Specific Class
          bInterfaceSubClass      0
          bInterfaceProtocol      0
          iInterface              0
          Endpoint Descriptor:
            bLength                 7
            bDescriptorType         5
            bEndpointAddress     0x81  EP 1 IN
            bmAttributes            2
              Transfer Type            Bulk
              Synch Type               None
              Usage Type               Data
            wMaxPacketSize     0x0040  1x 64 bytes
            bInterval               0
          Endpoint Descriptor:
            bLength                 7
            bDescriptorType         5
            bEndpointAddress     0x01  EP 1 OUT
            bmAttributes            2
              Transfer Type            Bulk
              Synch Type               None
              Usage Type               Data
            wMaxPacketSize     0x0040  1x 64 bytes
            bInterval               0
        Interface Descriptor:
          bLength                 9
          bDescriptorType         4
          bInterfaceNumber        1
          bAlternateSetting       0
          bNumEndpoints           2
          bInterfaceClass       255 Vendor Specific Class
          bInterfaceSubClass      0
          bInterfaceProtocol      0
          iInterface              0
          Endpoint Descriptor:
            bLength                 7
            bDescriptorType         5
            bEndpointAddress     0x82  EP 2 IN
            bmAttributes            2
              Transfer Type            Bulk
              Synch Type               None
              Usage Type               Data
            wMaxPacketSize     0x0040  1x 64 bytes
            bInterval               0
          Endpoint Descriptor:
            bLength                 7
            bDescriptorType         5
            bEndpointAddress     0x02  EP 2 OUT
            bmAttributes            2
              Transfer Type            Bulk
              Synch Type               None
              Usage Type               Data
            wMaxPacketSize     0x0040  1x 64 bytes
            bInterval               0
    
    Bus 001 Device 010: ID 0cad:9013 Motorola CGISS TETRA PEI interface
    Device Descriptor:
      bLength                18
      bDescriptorType         1
      bcdUSB               2.00
      bDeviceClass            0
      bDeviceSubClass         0
      bDeviceProtocol         0
      bMaxPacketSize0        64
      idVendor           0x0cad Motorola CGISS
      idProduct          0x9013
      bcdDevice           24.16
      iManufacturer           1
      iProduct                2
      iSerial                 0
      bNumConfigurations      1
      Configuration Descriptor:
        bLength                 9
        bDescriptorType         2
        wTotalLength       0x0037
        bNumInterfaces          2
        bConfigurationValue     1
        iConfiguration          3
        bmAttributes         0x80
          (Bus Powered)
        MaxPower              500mA
        Interface Descriptor:
          bLength                 9
          bDescriptorType         4
          bInterfaceNumber        0
          bAlternateSetting       0
          bNumEndpoints           2
          bInterfaceClass       255 Vendor Specific Class
          bInterfaceSubClass      0
          bInterfaceProtocol      0
          iInterface              0
          Endpoint Descriptor:
            bLength                 7
            bDescriptorType         5
            bEndpointAddress     0x81  EP 1 IN
            bmAttributes            2
              Transfer Type            Bulk
              Synch Type               None
              Usage Type               Data
            wMaxPacketSize     0x0200  1x 512 bytes
            bInterval               0
          Endpoint Descriptor:
            bLength                 7
            bDescriptorType         5
            bEndpointAddress     0x01  EP 1 OUT
            bmAttributes            2
              Transfer Type            Bulk
              Synch Type               None
              Usage Type               Data
            wMaxPacketSize     0x0200  1x 512 bytes
            bInterval               0
        Interface Descriptor:
          bLength                 9
          bDescriptorType         4
          bInterfaceNumber        1
          bAlternateSetting       0
          bNumEndpoints           2
          bInterfaceClass       255 Vendor Specific Class
          bInterfaceSubClass      0
          bInterfaceProtocol      0
          iInterface              0
          Endpoint Descriptor:
            bLength                 7
            bDescriptorType         5
            bEndpointAddress     0x82  EP 2 IN
            bmAttributes            2
              Transfer Type            Bulk
              Synch Type               None
              Usage Type               Data
            wMaxPacketSize     0x0200  1x 512 bytes
            bInterval               0
          Endpoint Descriptor:
            bLength                 7
            bDescriptorType         5
            bEndpointAddress     0x02  EP 2 OUT
            bmAttributes            2
              Transfer Type            Bulk
              Synch Type               None
              Usage Type               Data
            wMaxPacketSize     0x0200  1x 512 bytes
            bInterval               0
    
    Signed-off-by: Jerónimo Borque <jeronimo@borque.com.ar>
    Cc: stable <stable@vger.kernel.org>
    Signed-off-by: Johan Hovold <johan@kernel.org>

diff --git a/drivers/usb/serial/usb-serial-simple.c b/drivers/usb/serial/usb-serial-simple.c
index edbbb13d6de6..bd23a7cb1be2 100644
--- a/drivers/usb/serial/usb-serial-simple.c
+++ b/drivers/usb/serial/usb-serial-simple.c
@@ -86,6 +86,8 @@ DEVICE(moto_modem, MOTO_IDS);
 #define MOTOROLA_TETRA_IDS()			\
 	{ USB_DEVICE(0x0cad, 0x9011) },	/* Motorola Solutions TETRA PEI */ \
 	{ USB_DEVICE(0x0cad, 0x9012) },	/* MTP6550 */ \
+	{ USB_DEVICE(0x0cad, 0x9013) },	/* MTP3xxx */ \
+	{ USB_DEVICE(0x0cad, 0x9015) },	/* MTP85xx */ \
 	{ USB_DEVICE(0x0cad, 0x9016) }	/* TPG2200 */
 DEVICE(motorola_tetra, MOTOROLA_TETRA_IDS);
 

commit b81c2c33eab79dfd3650293b2227ee5c6036585c
Author: Max Schulze <max.schulze@posteo.de>
Date:   Mon Jan 7 08:31:49 2019 +0100

    USB: serial: simple: add Motorola Tetra TPG2200 device id
    
    Add new Motorola Tetra device id for Motorola Solutions TETRA PEI device
    
    T:  Bus=02 Lev=01 Prnt=01 Port=01 Cnt=01 Dev#=  4 Spd=480 MxCh= 0
    D:  Ver= 2.00 Cls=00(>ifc ) Sub=00 Prot=00 MxPS=64 #Cfgs=  1
    P:  Vendor=0cad ProdID=9016 Rev=24.16
    S:  Manufacturer=Motorola Solutions, Inc.
    S:  Product=TETRA PEI interface
    C:  #Ifs= 2 Cfg#= 1 Atr=80 MxPwr=500mA
    I:  If#= 0 Alt= 0 #EPs= 2 Cls=ff(vend.) Sub=00 Prot=00 Driver=usb_serial_simple
    I:  If#= 1 Alt= 0 #EPs= 2 Cls=ff(vend.) Sub=00 Prot=00 Driver=usb_serial_simple
    
    Signed-off-by: Max Schulze <max.schulze@posteo.de>
    Cc: stable <stable@vger.kernel.org>
    Signed-off-by: Johan Hovold <johan@kernel.org>

diff --git a/drivers/usb/serial/usb-serial-simple.c b/drivers/usb/serial/usb-serial-simple.c
index 4d0273508043..edbbb13d6de6 100644
--- a/drivers/usb/serial/usb-serial-simple.c
+++ b/drivers/usb/serial/usb-serial-simple.c
@@ -85,7 +85,8 @@ DEVICE(moto_modem, MOTO_IDS);
 /* Motorola Tetra driver */
 #define MOTOROLA_TETRA_IDS()			\
 	{ USB_DEVICE(0x0cad, 0x9011) },	/* Motorola Solutions TETRA PEI */ \
-	{ USB_DEVICE(0x0cad, 0x9012) }	/* MTP6550 */
+	{ USB_DEVICE(0x0cad, 0x9012) },	/* MTP6550 */ \
+	{ USB_DEVICE(0x0cad, 0x9016) }	/* TPG2200 */
 DEVICE(motorola_tetra, MOTOROLA_TETRA_IDS);
 
 /* Novatel Wireless GPS driver */

commit f5fad711c06e652f90f581fc7c2caee327c33d31
Author: Johan Hovold <johan@kernel.org>
Date:   Mon Sep 24 15:28:10 2018 +0200

    USB: serial: simple: add Motorola Tetra MTP6550 id
    
    Add device-id for the Motorola Tetra radio MTP6550.
    
    Bus 001 Device 004: ID 0cad:9012 Motorola CGISS
    Device Descriptor:
      bLength                18
      bDescriptorType         1
      bcdUSB               2.00
      bDeviceClass            0 (Defined at Interface level)
      bDeviceSubClass         0
      bDeviceProtocol         0
      bMaxPacketSize0        64
      idVendor           0x0cad Motorola CGISS
      idProduct          0x9012
      bcdDevice           24.16
      iManufacturer           1 Motorola Solutions, Inc.
      iProduct                2 TETRA PEI interface
      iSerial                 0
      bNumConfigurations      1
      Configuration Descriptor:
        bLength                 9
        bDescriptorType         2
        wTotalLength           55
        bNumInterfaces          2
        bConfigurationValue     1
        iConfiguration          3 Generic Serial config
        bmAttributes         0x80
          (Bus Powered)
        MaxPower              500mA
        Interface Descriptor:
          bLength                 9
          bDescriptorType         4
          bInterfaceNumber        0
          bAlternateSetting       0
          bNumEndpoints           2
          bInterfaceClass       255 Vendor Specific Class
          bInterfaceSubClass      0
          bInterfaceProtocol      0
          iInterface              0
          Endpoint Descriptor:
            bLength                 7
            bDescriptorType         5
            bEndpointAddress     0x81  EP 1 IN
            bmAttributes            2
              Transfer Type            Bulk
              Synch Type               None
              Usage Type               Data
            wMaxPacketSize     0x0200  1x 512 bytes
            bInterval               0
          Endpoint Descriptor:
            bLength                 7
            bDescriptorType         5
            bEndpointAddress     0x01  EP 1 OUT
            bmAttributes            2
              Transfer Type            Bulk
              Synch Type               None
              Usage Type               Data
            wMaxPacketSize     0x0200  1x 512 bytes
        Interface Descriptor:
          bLength                 9
          bDescriptorType         4
          bInterfaceNumber        1
          bAlternateSetting       0
          bNumEndpoints           2
          bInterfaceClass       255 Vendor Specific Class
          bInterfaceSubClass      0
          bInterfaceProtocol      0
          iInterface              0
          Endpoint Descriptor:
            bLength                 7
            bDescriptorType         5
            bEndpointAddress     0x82  EP 2 IN
            bmAttributes            2
              Transfer Type            Bulk
              Synch Type               None
              Usage Type               Data
            wMaxPacketSize     0x0200  1x 512 bytes
            bInterval               0
          Endpoint Descriptor:
            bLength                 7
            bDescriptorType         5
            bEndpointAddress     0x02  EP 2 OUT
            bmAttributes            2
              Transfer Type            Bulk
              Synch Type               None
              Usage Type               Data
            wMaxPacketSize     0x0200  1x 512 bytes
            bInterval               0
    Device Qualifier (for other device speed):
      bLength                10
      bDescriptorType         6
      bcdUSB               2.00
      bDeviceClass            0 (Defined at Interface level)
      bDeviceSubClass         0
      bDeviceProtocol         0
      bMaxPacketSize0        64
      bNumConfigurations      1
    Device Status:     0x0000
      (Bus Powered)
    
    Reported-by: Hans Hult <hanshult35@gmail.com>
    Cc: stable <stable@vger.kernel.org>
    Signed-off-by: Johan Hovold <johan@kernel.org>

diff --git a/drivers/usb/serial/usb-serial-simple.c b/drivers/usb/serial/usb-serial-simple.c
index 40864c2bd9dc..4d0273508043 100644
--- a/drivers/usb/serial/usb-serial-simple.c
+++ b/drivers/usb/serial/usb-serial-simple.c
@@ -84,7 +84,8 @@ DEVICE(moto_modem, MOTO_IDS);
 
 /* Motorola Tetra driver */
 #define MOTOROLA_TETRA_IDS()			\
-	{ USB_DEVICE(0x0cad, 0x9011) }	/* Motorola Solutions TETRA PEI */
+	{ USB_DEVICE(0x0cad, 0x9011) },	/* Motorola Solutions TETRA PEI */ \
+	{ USB_DEVICE(0x0cad, 0x9012) }	/* MTP6550 */
 DEVICE(motorola_tetra, MOTOROLA_TETRA_IDS);
 
 /* Novatel Wireless GPS driver */

commit fe710508b6ba9d28730f3021fed70e7043433b2e
Author: Collin May <collin@collinswebsite.com>
Date:   Sat Apr 7 14:32:48 2018 -0700

    USB: serial: simple: add libtransistor console
    
    Add simple driver for libtransistor USB console.
    This device is implemented in software:
    https://github.com/reswitched/libtransistor/blob/development/lib/usb_serial.c
    
    Signed-off-by: Collin May <collin@collinswebsite.com>
    Cc: stable <stable@vger.kernel.org>
    Signed-off-by: Johan Hovold <johan@kernel.org>

diff --git a/drivers/usb/serial/usb-serial-simple.c b/drivers/usb/serial/usb-serial-simple.c
index 4ef79e29cb26..40864c2bd9dc 100644
--- a/drivers/usb/serial/usb-serial-simple.c
+++ b/drivers/usb/serial/usb-serial-simple.c
@@ -63,6 +63,11 @@ DEVICE(flashloader, FLASHLOADER_IDS);
 					0x01) }
 DEVICE(google, GOOGLE_IDS);
 
+/* Libtransistor USB console */
+#define LIBTRANSISTOR_IDS()			\
+	{ USB_DEVICE(0x1209, 0x8b00) }
+DEVICE(libtransistor, LIBTRANSISTOR_IDS);
+
 /* ViVOpay USB Serial Driver */
 #define VIVOPAY_IDS()			\
 	{ USB_DEVICE(0x1d5f, 0x1004) }	/* ViVOpay 8800 */
@@ -110,6 +115,7 @@ static struct usb_serial_driver * const serial_drivers[] = {
 	&funsoft_device,
 	&flashloader_device,
 	&google_device,
+	&libtransistor_device,
 	&vivopay_device,
 	&moto_modem_device,
 	&motorola_tetra_device,
@@ -126,6 +132,7 @@ static const struct usb_device_id id_table[] = {
 	FUNSOFT_IDS(),
 	FLASHLOADER_IDS(),
 	GOOGLE_IDS(),
+	LIBTRANSISTOR_IDS(),
 	VIVOPAY_IDS(),
 	MOTO_IDS(),
 	MOTOROLA_TETRA_IDS(),

commit 46fe895e22ab3845515ec06b01eaf1282b342e29
Author: Johan Hovold <johan@kernel.org>
Date:   Thu Jan 18 14:46:41 2018 +1100

    USB: serial: simple: add Motorola Tetra driver
    
    Add new Motorola Tetra (simple) driver for Motorola Solutions TETRA PEI
    devices.
    
    D:  Ver= 2.00 Cls=00(>ifc ) Sub=00 Prot=00 MxPS=64 #Cfgs=  1
    P:  Vendor=0cad ProdID=9011 Rev=24.16
    S:  Manufacturer=Motorola Solutions Inc.
    S:  Product=Motorola Solutions TETRA PEI interface
    C:  #Ifs= 2 Cfg#= 1 Atr=80 MxPwr=500mA
    I:  If#= 0 Alt= 0 #EPs= 2 Cls=ff(vend.) Sub=00 Prot=00 Driver=(none)
    I:  If#= 1 Alt= 0 #EPs= 2 Cls=ff(vend.) Sub=00 Prot=00 Driver=(none)
    
    Note that these devices do not support the CDC SET_CONTROL_LINE_STATE
    request (for any interface).
    
    Reported-by: Max Schulze <max.schulze@posteo.de>
    Tested-by: Max Schulze <max.schulze@posteo.de>
    Cc: stable <stable@vger.kernel.org>
    Signed-off-by: Johan Hovold <johan@kernel.org>
    Signed-off-by: Greg Kroah-Hartman <gregkh@linuxfoundation.org>

diff --git a/drivers/usb/serial/usb-serial-simple.c b/drivers/usb/serial/usb-serial-simple.c
index 74172fe158df..4ef79e29cb26 100644
--- a/drivers/usb/serial/usb-serial-simple.c
+++ b/drivers/usb/serial/usb-serial-simple.c
@@ -77,6 +77,11 @@ DEVICE(vivopay, VIVOPAY_IDS);
 	{ USB_DEVICE(0x22b8, 0x2c64) }	/* Motorola V950 phone */
 DEVICE(moto_modem, MOTO_IDS);
 
+/* Motorola Tetra driver */
+#define MOTOROLA_TETRA_IDS()			\
+	{ USB_DEVICE(0x0cad, 0x9011) }	/* Motorola Solutions TETRA PEI */
+DEVICE(motorola_tetra, MOTOROLA_TETRA_IDS);
+
 /* Novatel Wireless GPS driver */
 #define NOVATEL_IDS()			\
 	{ USB_DEVICE(0x09d7, 0x0100) }	/* NovAtel FlexPack GPS */
@@ -107,6 +112,7 @@ static struct usb_serial_driver * const serial_drivers[] = {
 	&google_device,
 	&vivopay_device,
 	&moto_modem_device,
+	&motorola_tetra_device,
 	&novatel_gps_device,
 	&hp4x_device,
 	&suunto_device,
@@ -122,6 +128,7 @@ static const struct usb_device_id id_table[] = {
 	GOOGLE_IDS(),
 	VIVOPAY_IDS(),
 	MOTO_IDS(),
+	MOTOROLA_TETRA_IDS(),
 	NOVATEL_IDS(),
 	HP4X_IDS(),
 	SUUNTO_IDS(),

commit 627cfa89b1fe8d189ee71718fe9eb607026db301
Author: Johan Hovold <johan@kernel.org>
Date:   Fri Nov 3 18:12:08 2017 +0100

    USB: serial: fix module-license macros
    
    Several GPL-2.0 drivers used "GPL" rather than "GPL v2" in their
    MODULE_LICENSE macros; fix the macros to match the licenses.
    
    Signed-off-by: Johan Hovold <johan@kernel.org>
    Signed-off-by: Greg Kroah-Hartman <gregkh@linuxfoundation.org>

diff --git a/drivers/usb/serial/usb-serial-simple.c b/drivers/usb/serial/usb-serial-simple.c
index 2fc92d1d3c41..74172fe158df 100644
--- a/drivers/usb/serial/usb-serial-simple.c
+++ b/drivers/usb/serial/usb-serial-simple.c
@@ -131,4 +131,4 @@ static const struct usb_device_id id_table[] = {
 MODULE_DEVICE_TABLE(usb, id_table);
 
 module_usb_serial_driver(serial_drivers, id_table);
-MODULE_LICENSE("GPL");
+MODULE_LICENSE("GPL v2");

commit 6ca98bc2843e0bc4c2745ff6be7d46694c1398d1
Author: Greg Kroah-Hartman <gregkh@linuxfoundation.org>
Date:   Fri Nov 3 12:40:56 2017 +0100

    USB: serial: Remove redundant license text
    
    Now that the SPDX tag is in all USB files, that identifies the license
    in a specific and legally-defined manner.  So the extra GPL text wording
    can be removed as it is no longer needed at all.
    
    This is done on a quest to remove the 700+ different ways that files in
    the kernel describe the GPL license text.  And there's unneeded stuff
    like the address (sometimes incorrect) for the FSF which is never
    needed.
    
    No copyright headers or other non-license-description text was removed.
    
    Signed-off-by: Greg Kroah-Hartman <gregkh@linuxfoundation.org>
    Acked-by: Johan Hovold <johan@kernel.org>
    Signed-off-by: Greg Kroah-Hartman <gregkh@linuxfoundation.org>

diff --git a/drivers/usb/serial/usb-serial-simple.c b/drivers/usb/serial/usb-serial-simple.c
index 0d692f187d85..2fc92d1d3c41 100644
--- a/drivers/usb/serial/usb-serial-simple.c
+++ b/drivers/usb/serial/usb-serial-simple.c
@@ -9,10 +9,6 @@
  * Copyright (C) 2010 Zilogic Systems <code@zilogic.com>
  * Copyright (C) 2013 Wei Shuai <cpuwolf@gmail.com>
  * Copyright (C) 2013 Linux Foundation
- *
- *	This program is free software; you can redistribute it and/or
- *	modify it under the terms of the GNU General Public License version
- *	2 as published by the Free Software Foundation.
  */
 
 #include <linux/kernel.h>

commit 5fd54ace4721fc5ce2bb5aef6318fcf17f421460
Author: Greg Kroah-Hartman <gregkh@linuxfoundation.org>
Date:   Fri Nov 3 11:28:30 2017 +0100

    USB: add SPDX identifiers to all remaining files in drivers/usb/
    
    It's good to have SPDX identifiers in all files to make it easier to
    audit the kernel tree for correct licenses.
    
    Update the drivers/usb/ and include/linux/usb* files with the correct
    SPDX license identifier based on the license text in the file itself.
    The SPDX identifier is a legally binding shorthand, which can be used
    instead of the full boiler plate text.
    
    This work is based on a script and data from Thomas Gleixner, Philippe
    Ombredanne, and Kate Stewart.
    
    Cc: Thomas Gleixner <tglx@linutronix.de>
    Cc: Kate Stewart <kstewart@linuxfoundation.org>
    Cc: Philippe Ombredanne <pombredanne@nexb.com>
    Signed-off-by: Greg Kroah-Hartman <gregkh@linuxfoundation.org>
    Acked-by: Felipe Balbi <felipe.balbi@linux.intel.com>
    Acked-by: Johan Hovold <johan@kernel.org>
    Signed-off-by: Greg Kroah-Hartman <gregkh@linuxfoundation.org>

diff --git a/drivers/usb/serial/usb-serial-simple.c b/drivers/usb/serial/usb-serial-simple.c
index e98b6e57b703..0d692f187d85 100644
--- a/drivers/usb/serial/usb-serial-simple.c
+++ b/drivers/usb/serial/usb-serial-simple.c
@@ -1,3 +1,4 @@
+// SPDX-License-Identifier: GPL-2.0
 /*
  * USB Serial "Simple" driver
  *

commit f190fd92458da3e869b4e2c6289e2c617490ae53
Author: Daniele Palmas <dnlplm@gmail.com>
Date:   Fri Sep 2 10:37:56 2016 +0200

    USB: serial: simple: add support for another Infineon flashloader
    
    This patch adds support for Infineon flashloader 0x8087/0x0801.
    
    The flashloader is used in Telit LE940B modem family with Telit
    flashing application.
    
    Signed-off-by: Daniele Palmas <dnlplm@gmail.com>
    Cc: stable <stable@vger.kernel.org>
    Signed-off-by: Johan Hovold <johan@kernel.org>

diff --git a/drivers/usb/serial/usb-serial-simple.c b/drivers/usb/serial/usb-serial-simple.c
index a204782ae530..e98b6e57b703 100644
--- a/drivers/usb/serial/usb-serial-simple.c
+++ b/drivers/usb/serial/usb-serial-simple.c
@@ -54,7 +54,8 @@ DEVICE(funsoft, FUNSOFT_IDS);
 /* Infineon Flashloader driver */
 #define FLASHLOADER_IDS()		\
 	{ USB_DEVICE_INTERFACE_CLASS(0x058b, 0x0041, USB_CLASS_CDC_DATA) }, \
-	{ USB_DEVICE(0x8087, 0x0716) }
+	{ USB_DEVICE(0x8087, 0x0716) }, \
+	{ USB_DEVICE(0x8087, 0x0801) }
 DEVICE(flashloader, FLASHLOADER_IDS);
 
 /* Google Serial USB SubClass */

commit a0e80fbd56b4573de997c9a088a33abbc1121400
Author: Jonas Jonsson <jonas@ludd.ltu.se>
Date:   Sun Nov 22 11:47:18 2015 +0100

    USB: serial: Another Infineon flash loader USB ID
    
    The flash loader has been seen on a Telit UE910 modem. The flash loader
    is a bit special, it presents both an ACM and CDC Data interface but
    only the latter is useful. Unless a magic string is sent to the device
    it will disappear and the regular modem device appears instead.
    
    Signed-off-by: Jonas Jonsson <jonas@ludd.ltu.se>
    Tested-by: Daniele Palmas <dnlplm@gmail.com>
    Cc: stable <stable@vger.kernel.org>
    Signed-off-by: Johan Hovold <johan@kernel.org>

diff --git a/drivers/usb/serial/usb-serial-simple.c b/drivers/usb/serial/usb-serial-simple.c
index 3658662898fc..a204782ae530 100644
--- a/drivers/usb/serial/usb-serial-simple.c
+++ b/drivers/usb/serial/usb-serial-simple.c
@@ -53,6 +53,7 @@ DEVICE(funsoft, FUNSOFT_IDS);
 
 /* Infineon Flashloader driver */
 #define FLASHLOADER_IDS()		\
+	{ USB_DEVICE_INTERFACE_CLASS(0x058b, 0x0041, USB_CLASS_CDC_DATA) }, \
 	{ USB_DEVICE(0x8087, 0x0716) }
 DEVICE(flashloader, FLASHLOADER_IDS);
 

commit e7cf773d431a63a2417902696fcc9e0ebdc83bbe
Merge: 7a02d089695a 81e1dadfb5b2
Author: Linus Torvalds <torvalds@linux-foundation.org>
Date:   Sun Dec 14 14:57:16 2014 -0800

    Merge tag 'usb-3.19-rc1' of git://git.kernel.org/pub/scm/linux/kernel/git/gregkh/usb
    
    Pull USB updates from Greg KH:
     "Here's the big set of USB and PHY patches for 3.19-rc1.
    
      The normal churn in the USB gadget area is in here, as well as xhci
      and other individual USB driver updates.  The PHY tree is also in
      here, as there were dependancies on the USB tree.
    
      All of these have been in linux-next"
    
    * tag 'usb-3.19-rc1' of git://git.kernel.org/pub/scm/linux/kernel/git/gregkh/usb: (351 commits)
      arm: omap3: twl: remove usb phy init data
      usbip: fix error handling in stub_probe()
      usb: gadget: udc: missing curly braces
      USB: mos7720: delete some unneeded code
      wusb: replace memset by memzero_explicit
      usbip: remove unneeded structure
      usb: xhci: fix comment for PORT_DEV_REMOVE
      xhci: don't use the same variable for stopped and halted rings current TD
      xhci: clear extra bits from slot context when setting max exit latency
      xhci: cleanup finish_td function
      USB: adutux: NULL dereferences on disconnect
      usb: chipidea: fix platform_no_drv_owner.cocci warnings
      usb: chipidea: Fixed a few typos in comments
      Documentation: bindings: add doc for the USB2 ChipIdea USB driver
      usb: chipidea: add a usb2 driver for ci13xxx
      usb: chipidea: fix phy handling
      usb: chipidea: remove duplicate dev_set_drvdata for host_start
      usb: chipidea: parameter 'mode' isn't needed for hw_device_reset
      usb: chipidea: add controller reset API
      usb: chipidea: remove flag CI_HDRC_REQUIRE_TRANSCEIVER
      ...

commit a02001086bbfb4da35d1228bebc2f1b442db455f
Merge: eff264efeeb0 fc14f9c1272f
Author: Jiri Kosina <jkosina@suse.cz>
Date:   Thu Nov 20 14:42:02 2014 +0100

    Merge Linus' tree to be be to apply submitted patches to newer code than
    current trivial.git base

commit 679315e5fae1e4614eed0d9aa26999ddcb6a0f77
Author: Anton Staaf <robotboy@chromium.org>
Date:   Mon Nov 3 08:43:20 2014 -0800

    USB: serial: add Google simple serial SubClass support
    
    Add support for Google devices that export simple serial
    interfaces using the vendor specific SubClass/Protocol pair
    0x50/0x01.
    
    Signed-off-by: Anton Staaf <robotboy@chromium.org>
    Reviewed-by: Benson Leung <bleung@chromium.org>
    [johan: move id entries and update Kconfig]
    Signed-off-by: Johan Hovold <johan@kernel.org>

diff --git a/drivers/usb/serial/usb-serial-simple.c b/drivers/usb/serial/usb-serial-simple.c
index 7064eb8d6142..bc310112eae9 100644
--- a/drivers/usb/serial/usb-serial-simple.c
+++ b/drivers/usb/serial/usb-serial-simple.c
@@ -56,6 +56,14 @@ DEVICE(funsoft, FUNSOFT_IDS);
 	{ USB_DEVICE(0x8087, 0x0716) }
 DEVICE(flashloader, FLASHLOADER_IDS);
 
+/* Google Serial USB SubClass */
+#define GOOGLE_IDS()						\
+	{ USB_VENDOR_AND_INTERFACE_INFO(0x18d1,			\
+					USB_CLASS_VENDOR_SPEC,	\
+					0x50,			\
+					0x01) }
+DEVICE(google, GOOGLE_IDS);
+
 /* ViVOpay USB Serial Driver */
 #define VIVOPAY_IDS()			\
 	{ USB_DEVICE(0x1d5f, 0x1004) }	/* ViVOpay 8800 */
@@ -97,6 +105,7 @@ static struct usb_serial_driver * const serial_drivers[] = {
 	&zio_device,
 	&funsoft_device,
 	&flashloader_device,
+	&google_device,
 	&vivopay_device,
 	&moto_modem_device,
 	&novatel_gps_device,
@@ -111,6 +120,7 @@ static const struct usb_device_id id_table[] = {
 	ZIO_IDS(),
 	FUNSOFT_IDS(),
 	FLASHLOADER_IDS(),
+	GOOGLE_IDS(),
 	VIVOPAY_IDS(),
 	MOTO_IDS(),
 	NOVATEL_IDS(),

commit 8b648f13b4daa6c713691935aef7e64a7ff09a86
Author: Roman Mindalev <r000n@r000n.net>
Date:   Sat Sep 27 10:08:35 2014 +0400

    usb: Fix typo in usb-serial-simple.c
    
    Signed-off-by: Roman Mindalev <r000n@r000n.net>
    Signed-off-by: Jiri Kosina <jkosina@suse.cz>

diff --git a/drivers/usb/serial/usb-serial-simple.c b/drivers/usb/serial/usb-serial-simple.c
index fb79775447b0..675f9fae9cf2 100644
--- a/drivers/usb/serial/usb-serial-simple.c
+++ b/drivers/usb/serial/usb-serial-simple.c
@@ -58,7 +58,7 @@ DEVICE(vivopay, VIVOPAY_IDS);
 /* Motorola USB Phone driver */
 #define MOTO_IDS()			\
 	{ USB_DEVICE(0x05c6, 0x3197) },	/* unknown Motorola phone */	\
-	{ USB_DEVICE(0x0c44, 0x0022) },	/* unknown Mororola phone */	\
+	{ USB_DEVICE(0x0c44, 0x0022) },	/* unknown Motorola phone */	\
 	{ USB_DEVICE(0x22b8, 0x2a64) },	/* Motorola KRZR K1m */		\
 	{ USB_DEVICE(0x22b8, 0x2c84) },	/* Motorola VE240 phone */	\
 	{ USB_DEVICE(0x22b8, 0x2c64) }	/* Motorola V950 phone */

commit cff9c2339a6d5105d7f6b1f9a96dd1d239cc76ac
Author: Johan Hovold <johan@kernel.org>
Date:   Mon Aug 18 18:23:19 2014 +0200

    USB: serial: add Medtronic CareLink USB driver
    
    Add simple driver for Medtronic CareLink USB devices.
    
    Reported-by: Benjamin West <bewest@gmail.com>
    Tested-by: Benjamin West <bewest@gmail.com>
    Signed-off-by: Johan Hovold <johan@kernel.org>

diff --git a/drivers/usb/serial/usb-serial-simple.c b/drivers/usb/serial/usb-serial-simple.c
index 5565308c870c..7064eb8d6142 100644
--- a/drivers/usb/serial/usb-serial-simple.c
+++ b/drivers/usb/serial/usb-serial-simple.c
@@ -36,6 +36,11 @@ static struct usb_serial_driver vendor##_device = {		\
 
 #define DEVICE(vendor, IDS)	DEVICE_N(vendor, IDS, 1)
 
+/* Medtronic CareLink USB driver */
+#define CARELINK_IDS()			\
+	{ USB_DEVICE(0x0a21, 0x8001) }	/* MMT-7305WW */
+DEVICE(carelink, CARELINK_IDS);
+
 /* ZIO Motherboard USB driver */
 #define ZIO_IDS()			\
 	{ USB_DEVICE(0x1CBE, 0x0103) }
@@ -88,6 +93,7 @@ DEVICE(siemens_mpi, SIEMENS_IDS);
 
 /* All of the above structures mushed into two lists */
 static struct usb_serial_driver * const serial_drivers[] = {
+	&carelink_device,
 	&zio_device,
 	&funsoft_device,
 	&flashloader_device,
@@ -101,6 +107,7 @@ static struct usb_serial_driver * const serial_drivers[] = {
 };
 
 static const struct usb_device_id id_table[] = {
+	CARELINK_IDS(),
 	ZIO_IDS(),
 	FUNSOFT_IDS(),
 	FLASHLOADER_IDS(),

commit c5cd24d7b179a415df263e5b18b72f6e3aaf81e0
Author: Johan Hovold <johan@kernel.org>
Date:   Mon Aug 18 18:14:53 2014 +0200

    USB: serial: add Novatel Wireless GPS driver
    
    Add simple driver for Novatel Wireless GPS receivers.
    
    Reported-by: Kirk Madsen <kirkm@Navsys.com>
    Tested-by: Kirk Madsen <kirkm@Navsys.com>
    Signed-off-by: Johan Hovold <johan@kernel.org>

diff --git a/drivers/usb/serial/usb-serial-simple.c b/drivers/usb/serial/usb-serial-simple.c
index 02cb77a1e79d..5565308c870c 100644
--- a/drivers/usb/serial/usb-serial-simple.c
+++ b/drivers/usb/serial/usb-serial-simple.c
@@ -65,6 +65,11 @@ DEVICE(vivopay, VIVOPAY_IDS);
 	{ USB_DEVICE(0x22b8, 0x2c64) }	/* Motorola V950 phone */
 DEVICE(moto_modem, MOTO_IDS);
 
+/* Novatel Wireless GPS driver */
+#define NOVATEL_IDS()			\
+	{ USB_DEVICE(0x09d7, 0x0100) }	/* NovAtel FlexPack GPS */
+DEVICE_N(novatel_gps, NOVATEL_IDS, 3);
+
 /* HP4x (48/49) Generic Serial driver */
 #define HP4X_IDS()			\
 	{ USB_DEVICE(0x03f0, 0x0121) }
@@ -88,6 +93,7 @@ static struct usb_serial_driver * const serial_drivers[] = {
 	&flashloader_device,
 	&vivopay_device,
 	&moto_modem_device,
+	&novatel_gps_device,
 	&hp4x_device,
 	&suunto_device,
 	&siemens_mpi_device,
@@ -100,6 +106,7 @@ static const struct usb_device_id id_table[] = {
 	FLASHLOADER_IDS(),
 	VIVOPAY_IDS(),
 	MOTO_IDS(),
+	NOVATEL_IDS(),
 	HP4X_IDS(),
 	SUUNTO_IDS(),
 	SIEMENS_IDS(),

commit b9f040389e23fb95fde36cb0a3c2c516fb3e9d1c
Author: Johan Hovold <johan@kernel.org>
Date:   Mon Aug 18 18:14:52 2014 +0200

    USB: serial: add support for multi-port simple drivers
    
    Add support for multi-port simple drivers.
    
    Signed-off-by: Johan Hovold <johan@kernel.org>

diff --git a/drivers/usb/serial/usb-serial-simple.c b/drivers/usb/serial/usb-serial-simple.c
index fb79775447b0..02cb77a1e79d 100644
--- a/drivers/usb/serial/usb-serial-simple.c
+++ b/drivers/usb/serial/usb-serial-simple.c
@@ -20,7 +20,7 @@
 #include <linux/usb.h>
 #include <linux/usb/serial.h>
 
-#define DEVICE(vendor, IDS)					\
+#define DEVICE_N(vendor, IDS, nport)				\
 static const struct usb_device_id vendor##_id_table[] = {	\
 	IDS(),							\
 	{ },							\
@@ -31,9 +31,10 @@ static struct usb_serial_driver vendor##_device = {		\
 		.name =		#vendor,			\
 	},							\
 	.id_table =		vendor##_id_table,		\
-	.num_ports =		1,				\
+	.num_ports =		nport,				\
 };
 
+#define DEVICE(vendor, IDS)	DEVICE_N(vendor, IDS, 1)
 
 /* ZIO Motherboard USB driver */
 #define ZIO_IDS()			\

commit 2240c365108adbc4100a55654a5707e8e877a401
Author: Kristóf Ralovich <kristof.ralovich@gmail.com>
Date:   Fri Jan 24 12:18:35 2014 +0100

    USB: simple: add Dynastream ANT USB-m Stick device support
    
    Add support for ANT USB-m Stick from Dynastream Innovations, by listing
    USB pid
    
    [34366.944805] usb 6-1: New USB device found, idVendor=0fcf, idProduct=1009
    [34366.944817] usb 6-1: New USB device strings: Mfr=1, Product=2, SerialNumber=3
    [34366.944824] usb 6-1: Product: ANT USB-m Stick
    [34366.944831] usb 6-1: Manufacturer: Dynastream Innovations
    
    Device reported (https://code.google.com/p/antpm/issues/detail?id=5) to
    work through:
    $ modprobe usbserial vendor=0x0fcf product=0x1009
    
    Signed-off-by: Kristóf Ralovich <kristof.ralovich@gmail.com>
    Signed-off-by: Johan Hovold <jhovold@gmail.com>
    Cc: stable <stable@vger.kernel.org>
    Signed-off-by: Greg Kroah-Hartman <gregkh@linuxfoundation.org>

diff --git a/drivers/usb/serial/usb-serial-simple.c b/drivers/usb/serial/usb-serial-simple.c
index f112b079ddfc..fb79775447b0 100644
--- a/drivers/usb/serial/usb-serial-simple.c
+++ b/drivers/usb/serial/usb-serial-simple.c
@@ -71,7 +71,8 @@ DEVICE(hp4x, HP4X_IDS);
 
 /* Suunto ANT+ USB Driver */
 #define SUUNTO_IDS()			\
-	{ USB_DEVICE(0x0fcf, 0x1008) }
+	{ USB_DEVICE(0x0fcf, 0x1008) },	\
+	{ USB_DEVICE(0x0fcf, 0x1009) } /* Dynastream ANT USB-m Stick */
 DEVICE(suunto, SUUNTO_IDS);
 
 /* Siemens USB/MPI adapter */

commit 803a536243b3a1ed2289f41897b11b72bd083309
Author: Paul Gortmaker <paul.gortmaker@windriver.com>
Date:   Wed Jan 8 11:08:26 2014 -0500

    usb: delete non-required instances of include <linux/init.h>
    
    None of these files are actually using any __init type directives
    and hence don't need to include <linux/init.h>.  Most are just a
    left over from __devinit and __cpuinit removal, or simply due to
    code getting copied from one driver to the next.
    
    Signed-off-by: Paul Gortmaker <paul.gortmaker@windriver.com>
    Signed-off-by: Greg Kroah-Hartman <gregkh@linuxfoundation.org>

diff --git a/drivers/usb/serial/usb-serial-simple.c b/drivers/usb/serial/usb-serial-simple.c
index 52eb91f2eb2a..f112b079ddfc 100644
--- a/drivers/usb/serial/usb-serial-simple.c
+++ b/drivers/usb/serial/usb-serial-simple.c
@@ -15,7 +15,6 @@
  */
 
 #include <linux/kernel.h>
-#include <linux/init.h>
 #include <linux/tty.h>
 #include <linux/module.h>
 #include <linux/usb.h>

commit 68c91d377c9bd14cbe35c647ed3b847f7862c958
Author: Yann Droneaud <ydroneaud@opteya.com>
Date:   Sun Aug 18 21:29:00 2013 +0200

    USB: serial: fix stringify operator in usb-serial-simple
    
    usb-serial-simple uses an unknown stringify macro that make
    all drivers being named "stringify(vendor)".
    
    This can be a problem when two drivers have the same (wrong) name:
    
        kernel: usbcore: registered new interface driver usb_serial_simple
        kernel: usbserial: USB Serial support registered for stringify(vendor)
        kernel Error: Driver 'stringify(vendor)' is already registered, aborting...
        kernel: usbserial: problem -16 when registering driver stringify(vendor)
        kernel: usbserial: USB Serial deregistering driver stringify(vendor)
        kernel: usbcore: deregistering interface driver usb_serial_simple
    
    Before the fix:
    
        $ strings drivers/usb/serial/usb-serial-simple.o
        usb_serial_simple
        stringify(vendor)
    
    After the fix:
    
        $ strings drivers/usb/serial/usb-serial-simple.o
        usb_serial_simple
        funsoft
        flashloader
        vivopay
        moto_modem
        hp4x
        suunto
        siemens_mpi
    
    This patch makes usb-serial-simple use the correct stringify operator.
    
    Signed-off-by: Yann Droneaud <ydroneaud@opteya.com>
    Signed-off-by: Greg Kroah-Hartman <gregkh@linuxfoundation.org>

diff --git a/drivers/usb/serial/usb-serial-simple.c b/drivers/usb/serial/usb-serial-simple.c
index 6a06131f48f4..52eb91f2eb2a 100644
--- a/drivers/usb/serial/usb-serial-simple.c
+++ b/drivers/usb/serial/usb-serial-simple.c
@@ -29,7 +29,7 @@ static const struct usb_device_id vendor##_id_table[] = {	\
 static struct usb_serial_driver vendor##_device = {		\
 	.driver = {						\
 		.owner =	THIS_MODULE,			\
-		.name =		"stringify(vendor)",		\
+		.name =		#vendor,			\
 	},							\
 	.id_table =		vendor##_id_table,		\
 	.num_ports =		1,				\

commit 1f9230713af17657f7ed503a12ddd739d0f48089
Author: Greg Kroah-Hartman <gregkh@linuxfoundation.org>
Date:   Mon Aug 5 19:27:19 2013 +0800

    USB: serial: move the "simple" drivers into usb-serial-simple.c
    
    Instead of having to create a new driver for a "simple" usb to serial
    device, mush them all into one file, with a macro, so as to make it easy
    to add new ones.
    
    Cc: "René Bürgel" <rene.buergel@sohard.de>
    Acked-by: Wei Shuai <cpuwolf@gmail.com>
    Cc: Josh Triplett <josh@joshtriplett.org>
    Acked-by: Frans Klaver <frans.klaver@xsens.com>
    Cc: "Wesley W. Terpstra" <w.terpstra@gsi.de>
    Cc: Johan Hovold <jhovold@gmail.com>
    Signed-off-by: Greg Kroah-Hartman <gregkh@linuxfoundation.org>

diff --git a/drivers/usb/serial/usb-serial-simple.c b/drivers/usb/serial/usb-serial-simple.c
new file mode 100644
index 000000000000..6a06131f48f4
--- /dev/null
+++ b/drivers/usb/serial/usb-serial-simple.c
@@ -0,0 +1,110 @@
+/*
+ * USB Serial "Simple" driver
+ *
+ * Copyright (C) 2001-2006,2008,2013 Greg Kroah-Hartman <greg@kroah.com>
+ * Copyright (C) 2005 Arthur Huillet (ahuillet@users.sf.net)
+ * Copyright (C) 2005 Thomas Hergenhahn <thomas.hergenhahn@suse.de>
+ * Copyright (C) 2009 Outpost Embedded, LLC
+ * Copyright (C) 2010 Zilogic Systems <code@zilogic.com>
+ * Copyright (C) 2013 Wei Shuai <cpuwolf@gmail.com>
+ * Copyright (C) 2013 Linux Foundation
+ *
+ *	This program is free software; you can redistribute it and/or
+ *	modify it under the terms of the GNU General Public License version
+ *	2 as published by the Free Software Foundation.
+ */
+
+#include <linux/kernel.h>
+#include <linux/init.h>
+#include <linux/tty.h>
+#include <linux/module.h>
+#include <linux/usb.h>
+#include <linux/usb/serial.h>
+
+#define DEVICE(vendor, IDS)					\
+static const struct usb_device_id vendor##_id_table[] = {	\
+	IDS(),							\
+	{ },							\
+};								\
+static struct usb_serial_driver vendor##_device = {		\
+	.driver = {						\
+		.owner =	THIS_MODULE,			\
+		.name =		"stringify(vendor)",		\
+	},							\
+	.id_table =		vendor##_id_table,		\
+	.num_ports =		1,				\
+};
+
+
+/* ZIO Motherboard USB driver */
+#define ZIO_IDS()			\
+	{ USB_DEVICE(0x1CBE, 0x0103) }
+DEVICE(zio, ZIO_IDS);
+
+/* Funsoft Serial USB driver */
+#define FUNSOFT_IDS()			\
+	{ USB_DEVICE(0x1404, 0xcddc) }
+DEVICE(funsoft, FUNSOFT_IDS);
+
+/* Infineon Flashloader driver */
+#define FLASHLOADER_IDS()		\
+	{ USB_DEVICE(0x8087, 0x0716) }
+DEVICE(flashloader, FLASHLOADER_IDS);
+
+/* ViVOpay USB Serial Driver */
+#define VIVOPAY_IDS()			\
+	{ USB_DEVICE(0x1d5f, 0x1004) }	/* ViVOpay 8800 */
+DEVICE(vivopay, VIVOPAY_IDS);
+
+/* Motorola USB Phone driver */
+#define MOTO_IDS()			\
+	{ USB_DEVICE(0x05c6, 0x3197) },	/* unknown Motorola phone */	\
+	{ USB_DEVICE(0x0c44, 0x0022) },	/* unknown Mororola phone */	\
+	{ USB_DEVICE(0x22b8, 0x2a64) },	/* Motorola KRZR K1m */		\
+	{ USB_DEVICE(0x22b8, 0x2c84) },	/* Motorola VE240 phone */	\
+	{ USB_DEVICE(0x22b8, 0x2c64) }	/* Motorola V950 phone */
+DEVICE(moto_modem, MOTO_IDS);
+
+/* HP4x (48/49) Generic Serial driver */
+#define HP4X_IDS()			\
+	{ USB_DEVICE(0x03f0, 0x0121) }
+DEVICE(hp4x, HP4X_IDS);
+
+/* Suunto ANT+ USB Driver */
+#define SUUNTO_IDS()			\
+	{ USB_DEVICE(0x0fcf, 0x1008) }
+DEVICE(suunto, SUUNTO_IDS);
+
+/* Siemens USB/MPI adapter */
+#define SIEMENS_IDS()			\
+	{ USB_DEVICE(0x908, 0x0004) }
+DEVICE(siemens_mpi, SIEMENS_IDS);
+
+/* All of the above structures mushed into two lists */
+static struct usb_serial_driver * const serial_drivers[] = {
+	&zio_device,
+	&funsoft_device,
+	&flashloader_device,
+	&vivopay_device,
+	&moto_modem_device,
+	&hp4x_device,
+	&suunto_device,
+	&siemens_mpi_device,
+	NULL
+};
+
+static const struct usb_device_id id_table[] = {
+	ZIO_IDS(),
+	FUNSOFT_IDS(),
+	FLASHLOADER_IDS(),
+	VIVOPAY_IDS(),
+	MOTO_IDS(),
+	HP4X_IDS(),
+	SUUNTO_IDS(),
+	SIEMENS_IDS(),
+	{ },
+};
+MODULE_DEVICE_TABLE(usb, id_table);
+
+module_usb_serial_driver(serial_drivers, id_table);
+MODULE_LICENSE("GPL");
